username,userId,entryTitle,entryTitleId,entryId,entry,entryDate
endemikdavar,1225362,rus turistlerin olmadığı bir antalya,4975222,56524759,"ruslar gelmezse kaliteli avrupalı gelir diyen arkadaşların yılda 2 haftayla sınırlı sanırım turizm anlayışı. la neredeyse savaşın eşiğindeyiz 2015 yazındaki akdeniz egenin binlerce km ötesinde patlayan bomba yüzünden avrupadan ne kadar iptal alındığını biliyor musunuz ? avrupalılar canını sokakta mı buldu ? ingiliz haberlerinden bahsedeyim size, şöyle "" türkiye rus uçağını vurdu 2 pilot öldü"" bu kadar. bunu diyip diğer habere geçiyor, bizim haber bültenleri gibi yok adama biri tekme vurmuş, düşmüş nedeni neydi ? az sonra..... az sonra adamla ayrı röpörtaj görgü tanıklarıyla ayrı röpörtaj yapmıyor. o haberleri izleyen adama göre şuanda savaş çoktan başladı başlamasa bile başlama ihtimali var, neden türkiyeye gelsin ki ? british pound türk lirası karşısında aman da ne kadar değerli diye canını riske atar mı ? daha bu yaz görmedik mi marmariste animasyon ekibinin işidçi kılığına girip adamların ödünü bokuna karıştırdığını ? insan hayatı değerli beyler avrupada, bu tarz krizi sevenler ruslardır. arap baharı başlayıp mısır boşaltıldığında banane ben gitmeyeceğim diyen ruslar biliyorum ben. neden ? kriz döneminde oteller, uçaklar daha ucuz çünkü. işin uzmanı olarak daha yazasım var ama bende saat çok geç, bu tüyolarla idare edin şimdilik. hayde spokoynoy nochi",26.11.2015 20:07
endemikdavar,1225362,konuşurken araya ingilizce sözcük sıkıştıran kişi,985638,56512539,"merhaba yine ben, daha once bu gruba dahil oldugumu belirtmistim ama suan sicagi sicagina olmus birseyi paylasmak isterim. yalniz yasayan erkek bir is arkadasim katmer yapmaya calistigi ama hamurun sert oldugu ile ilgili benden tavsiye aliyordu ( yapmaya calistigi sey sac boregiymis o ayri konu ama) neyse ne gerek var ugrasiyosun zaten uc kilo adamsin,yagli yemekle ilgili sorunun yok, gidip su indian parathalardan alsana dedim ama indian parathanin bizdeki hangi hamura karsilik geldigini 10 dakika dusundum bulamadim.goruntu aklimda, onunla yapilan hersey aklimda ama adi gelmiyor aklima, o da ""ha yagli yufka gibi bisi o zaman, tamam alayim""dedi.cunku yillardir milfoy hamuru iceren bir cumle kurmadim ve beyin onu ister istemez arka raflara atiyor. demem o ki, o kadar buyutmeyin artik su mevzuyu. ama turkiyede yasayip is arkadaslariyla olan toplasmalar haric sosyal ortamlarda omg, no way, haters gonna hate diyenlerin agzina kurekle vurun.",26.11.2015 10:09
endemikdavar,1225362,evlenmek vs aynı evde yaşamak,4792959,56502096,"kastedilen şey maddiyat yani eve yatırım eşya falansa genelde er kişiyi yorar, çünkü genelde nedendir bilmiyorum erkeklerde bir ev eşyası alma durumu söz konusu oluyor ama bana tam tersi denk geldi, 3,5 yıl boyunca baştan sona ev kurdum ha sonra evden yollamak kolay oldu en azından ama erkek alırsa herşeyi sadece ceketini alıp çıkıyor, 3 ev dayayıp döşemiş arkadaşlarım var.romantizme, ilişkiye kattığı heyecana, rutinliğe değinecek olursak evet bunu herkes yaşamalı. ama bu insanlar genellikle ayrılırlar hatta ben 6 yıl aynı evde yaşayıp evlenip 1 ay sonra ayrılan da gördüm o yüzden bu birlikte yaşama olayında bile insanlar birbirlerini tanıyamıyorlar. genelde kadın tarafı işten aynı saatlerde gelseler bile hemen mutfağın yolunu tutup yemek yapma telaşına giriyor, erkek normal bir tip ise bulaşıklara devam. pazarlarınız kimin önce süpürge yapması ve kimin paspas yapması kararını vermekler geçiyor. onun dışında herşey evlilikteki gibi.birde hala ayrı ayrı arkadaşlarla çıkamıyorsunuz, genelde hepsi sizde toplanıyor hepsi bekar ve çift olarak misafirliğe gelirler kızlar mutfağa geçer erkekler futbol muhabbeti yapar. zaten işten gelmişsinizdir onları iyi ağırlayacağım diye çırpınır durursunuz herkes gittikten sonra bulaşıklar dağ olmuştur ama sevgiliniz hadi çok yoruldun yatalım der, bulaşıklar ertesi güne kalabilir ( evliyseniz kalamaz) ama sonuçta mutfağı sabah yine siz toplayacaksınız. ha bu arada bu gece yeme içmeleri bir türlü bitmez, misafir eksik olmaz, manken gibiyken çıkmaya başladığınız adamla 3,5 senenin sonunda 96 kilo olabilirsiniz, çünkü size kilo çok yakışıyordur sizi çok beğeniyordur (yalan, bulmuş sizin gibi yolunacak kazı niye bıraksın, bırakmayıp ciğerinizi beslemeye devam eder ki söküp çıkarabilsin ayrılırken)(bkz: kaz cigeri)çalışıyorsanız maaşınızla, öğrenciyseniz harçlığınızla plan yapamazsınız çünkü hali hazırda birçok şeyi kartla aldığınız için ve genelde o kartlar erkek kişisine aittir, onların ödenmesi gerekir, tüm maaşı ona verebilirsiniz. ( 2005 yılında 10.000 tl ödedim) saymak istediğim çok şey var ama günler geceler lazım. uzun lafın kısası iyi yönleri yok değil ama kötü yanları çok daha fazla, gelmeli gitmeli kalmalı olun ama evlenmeden kimseyle aynı evde yaşamayın, hatta ev arkadaşı da almayın ben alkolik kız arkadaş yüzünden koltukları da değiştirmek zorunda kaldım, dark bira dökmüştü hayvan. ya da bilmiyorum bana kötüleri denk geldi, belki sizinkiler iyi olacak.bol şans.",25.11.2015 20:41 ~ 26.11.2015 05:09
endemikdavar,1225362,türkiye turizminin bitmesi,4973944,56492816,"(#56492625) ilaveten, bizi asil korkutan diger kisim da, rusyada turizm sektorunde faaliyet gosteren, turkiye dahil cesitli destinasyonlara rus turist gonderen iki buyuk firma da turk firmasidir. eger isler kizisir ise bu firmalarin rusya merkezleri de tehlike altinda oldugu gibi, binlerce calisan da ayni sekilde issiz kalma riskiyle karsi karsiyadir.",25.11.2015 13:07
endemikdavar,1225362,çanta askısını meme arasına sokan kadının amacı,4876684,56489000,capraz askili cantalari bununla karistiran atlarin zoruna gitmistir.,25.11.2015 09:49
endemikdavar,1225362,bira içip tuvalete gitmeme karizması,4881482,56488839,"karizmasi nerede anlamadigim durum, bunlardan biri de benim. icip icip tuvalete gidemedigim icin karnimda galonla dolasmak zorunda kaliyorum bu yuzden bir bira ile sinirliyim, evden cikarken giydigim uzerime oturan icinde super gozuktugumu dusundugum elbise eger birden fazla icersem ingilizler gibi oramdan buramdan tasiyor gibi oluyor. bunun neresi karizma ?",25.11.2015 09:41
endemikdavar,1225362,konuşurken araya ingilizce sözcük sıkıştıran kişi,985638,56487363,"ben de o kisilerdenim. neden ? cunku essegin.... neyse turizmciyim, is arkadasimla konusurken "" bu rezervasyon erken rezervasyon indirimi aliyor mu ? "" demek yerine ""bu res eb li mi "" diyorum, otelin kontratinda satisa kesinlikle kapali tarihler var, dikkat ettin mi demek yerine, kontratta black out var, dikkat ettin mi diyorum. satislarin en cok gelecegi yilbasi gibi donemler yerine "" peak period"" diyorum ve anlasilmama gibi bir durumum soz konusu degil cunku zamanla yaristigin isler yapiyorsun ve mahkeme dilekcesi gibi konusmana gerek yok ve kaldiki kullandigin terimlerin turkce karsiligi da yok cogu yerde. ama babamla isimden konusurken turkceyi bile basite indirgemeye calisiyorum, akdeniz canagindaki ulkeler demek yerine tek tek ulke ismi sayiyorum, cunku babamlaysam tatildeyim demek, tatil demek bos vakit demek.",25.11.2015 06:52
endemikdavar,1225362,ruslar tarafindan erdoğan'a yapılmış video,4973643,56487177,ruslarda sense of humor olayi yok abi iste bu yuzden korkmaliyiz adamlarin sakasi yok. videoya gelince ; saglam erkek erdogan dan sonra dinleyemedim.,25.11.2015 05:30
endemikdavar,1225362,onlar doğalgazı keserse biz de domates satmayız,4973101,56487140,"akdeniz ve ege bolgesindeki otellerde de multeci yatirirsak bu is tamamdir. ek bilgi ; sadece antalyanin otel/yatak kapasitesi 500.000 ve bunun % 70-80 ini rus turist dolduruyordu. bu da 01.04.2016-31.10.2016 arasinda 5-6.000.000 rus turistin kaybi demektir. sgk ya kayitli 195.000 civari turizm calisani var, turizmdek ekmek yiyen ssk siz binlerle birlikte bu rakam 250.000 i bulur. ama tabiki endiseye mahal yok yuce hukumetimizin bu 250.000 kisiye istihdam saglayacagindan suphem yok, tutun ki saglayamadi o zaman dogalgaz kullanan illerdeki arkadaslara bu 250.000 kisiyi satariz, kisin yakar isinirlar.",25.11.2015 05:16
endemikdavar,1225362,rusya'nın türkiye'ye muhtaç olması,4972949,56475012,"rusyadan sadece doğalgaz aldığımızı ve bunu ukrayna için bile kesmediyse bizim için hiç kesmeyeceğini düşünen mal beyanı. herşeyi geçtim akdeniz bölgesinde yetişen sebzelerin nereye ihraç edildiğinden bi haber sanırım. kısa bir zaman önce domates yüklü kamyonları geri gönderdiğinde o çiftçiye ne oldu haberi var mı acaba ?edit; yıllardır içlerinde olan biri olarak, rus milliyetçiliğinin yanında türk milliyetçiliği anca mahalle takımı tutmaya benzer,aferin bize şimdi celal şengörle birlikte bok yiyebiliriz.2. edit ; olm adam kargo uçağı düşürüldü diye mısıra uçuşları yasakladı, siz bu ülkenin en büyük gelir kaynağının turizm ve 6 milyon rus turist olduğunun nasıl farkında değilsiniz lan ? hala doğalgaz diyorlar amk.",24.11.2015 17:36 ~ 18:37
endemikdavar,1225362,yılda 6 ay tatil yapan mesleğin özel günü olması,4972612,56464829,"hayatta yapamayacagin bir meslek soyle dedikleri zaman hep ogretmenlik demisimdir. nedenine gelince, hepimizin isyerinde yasadigi birseydir birilerine birsey ogretmek, daha dogrusu ogretememek, birisi gelir yuz yildir ayni isi yapiyormuscasina kapar isleri bir digerine aylarca ogretemezsiniz, ogretemediginiz durumda git hesabini kestir dersiniz ya da ustlerinize rapor eder onlar derler git hesabini kestir diye. simdi tum bu cercevede tekrar dusunun,ogretmen dedigin insan akillisiyla, serserisiyle, gerizekalisiyla ayirt etmeden onlara birseyler katabilmekle yukumlu bir insan evladi. 12 sene boyunca ders bos olsun okuldan kacayim,su sene bitsin seneye bu dersi gormeyecegim nasilsa dedigin dersi emekli olana kadar anlatmak zorunda olan bir insan. simdi su soruyu sorun kendinize; siz ogretmenlik yapabilir misiniz ? ha yapabiliyorsaniz gidin yapin o zaman adamin asabini bozmayin. la ben kardesime birsey ogretmeye calisirken cinnet geciriyorum, yillarca yuzlerce insanla ugrasmak ? basari ve basarisizliklarindan sorumlu olmak ? yoo dostum yoo, yigidi oldur hakkini yeme. (yukarida saydiklarim dayakci, bilgisiz, sadece kpss yi kazanip kendi egitimine yillarca tek birsey eklememis ogretmenleri kapsamamaktadir. )",24.11.2015 10:38
endemikdavar,1225362,christmas pudding,1403116,56462019,"her yil marks&spencer dan almak istedigim ama lan ben bunu tek basima yiyemem o kadar parayi bosuna vermeyeyim dedigim bol meyveli pudding. neyse bu yil alicam, arkadaslar geliyor.",24.11.2015 06:12
endemikdavar,1225362,doğan çocuğun evine mutluluk getirmesi,4971782,56441183,"ablam ve enistemin evine kesinlikle mutluluk getirecek olan bebektir. 3 senedir doktorlar normal yolla cocugunuz olmaz tup bebek sart diyip duruyorlardi, tup bebek prosedurune hazirlik zaten zor, masraflar ayri zor, sonucun olumlu olup olmayacagi belirsiz derken psikolojileri alt ust olmustu. bunu soylemek bana cok garip geliyor ama birisinin tavsiyesi uzerine hoca olan bir dedeye gittiler, dede okumus filan ikisine, ( anlatan baskasi olsa inanmam) suanda 6 haftalik hamile. umarim saglikli olur, umarim hersey yolunda gider.",23.11.2015 10:40
endemikdavar,1225362,daha güzel bir dünya için ne yapmalıyız,4971669,56438781,"herkes koyune donsun mesela, koylerimizi kalkindiralim bu surecte tek derdimiz komsunun danasinin diger komsunun bostanina girmesi olsun. aaa bak gordun mu hem danayi baglamamis hem de hic orali olmuyor diyelim.tabi bunlari oglen 3 gibi cay ve gozleme yerken konusalim.",23.11.2015 07:20
endemikdavar,1225362,hayatında tek başarısı öğretmen olmak olan insan,4262407,56427702,"bizim kasabadan okuyup çıkabilen 2 kişiden biriyim, bir diğeri karsta bilmemne üniversitesinde sosyal bilgiler öğretmenliği kazandı, okudu. o orada öğretmenlik okurken ben turizmci oldum(alaylı, mektepli), çocukluğum, gençlik dönemim bak bak o kız gitti öğretmenlik okudu sen ne yapıyorsun, ne olacaksın şimdi amacın ne sorularıyla aile ve komşular tarafından bir küçümseme olayıyla geçti. üniversite bittikten sonra 8, okul dönemi ve öncesiyle birlikte 14 yıllık bir cv sahibiyim, 2005 yılından sonra da full ssklıyım. bir sürü ülke gördüm, diller öğrendim, insanlarla tanıştım ama o kız hala kasabada, okulu bitirdi ama 8 senedir kpss ye hazırlanıyor. yanlış anlaşılmasın öğretmenlerle ilgili bir sorunum yok, şimdi bu kız hadi diyelim kpss yi kazanıp atandı, okul hayatından bu kadar kopmuşken son 8 yılında aktif hiçbirşey yapmamışken bir insan yetiştirme konusunda ne kadar başarılı olabilir ? bence insanların sorunu meslekle değil mesleği başarılı bir şekilde icra etmekle. arkadaşım değil ama facebookta bakıyorum sayfasına arada, 15 yaşında ergenlerin yazdığı şekilde atarlı yazılar paylaşıyor, çocuklara ders kitapları haricinde birşeyler verebilmektir bence öğretmenlik, hayata kendin hazırlanamamışken, ufacık, sana muhtaç çocuklara nasıl güzel bir eğitim verebilirsin ki ?",22.11.2015 19:59
endemikdavar,1225362,75 bin dolara 365 günlük dünya turu,4971310,56426380,"hali hazırda bangkoktayken katılsam mı diye düşündüren turdur. ancak, 2 eksiğim var 75 bin usd ve 365 gün izin.",22.11.2015 19:09
endemikdavar,1225362,ütüyü ben yaparım sen maç izle diyen kadın,4971296,56426277,"bunu söylerken ki ses tonu önemlidir,""ütüyü ben yaparım sen maç izle "" deyip bırakıyorsa kesin laf sokmuştur bunun hesabını sorar elbet ertesi gün. devamında başka başka şeyler ne bileyim sonra da dışarıya çıkarız, sonra da mısır patlatırım, sonra da .... devam ediyorsa şüphe etmeyin, sarılın.",22.11.2015 19:05
endemikdavar,1225362,birlikte gitmeyen yiyecekler,4971315,56426205,yıllarca reçel bal türevlerini peynirle karıştıranlara iğrenerek bakıp birgün onların tesadüfen karışmasıyla ulen ben bunu nasıl kaçırdım yıllarca dedim kendime. önyargılarınızı yıkın ama çokta karıştırmayın.,22.11.2015 19:02
endemikdavar,1225362,dışkı yedirmek işkence değildir,4970927,56417551,bok yediğinden karnı ağrıyor.,22.11.2015 11:10
endemikdavar,1225362,ailesine yük olmamak için okurken çalışan embesil,4617898,56405576,"28 yaşında 14 yıllık dolu dolu bir cv ye sahip olarak aralarında bulunduğum insan türü. aileye yük olmamak için falan değil kendi ayaklarımın üzerinde durmak için gerçekleştirdiğim eylemler bütünüdür. yaşıtlarım ve okul arkadaşlarım benim 5 yıl önce olduğum pozisyona gelmek için kıçlarını yırtarken aferin kız sana diye kendimle defalarca gururlanmama da sebep olmuştur, ama cocukluğu, gençliği kaçırmak, liseden, üniversiteden toplasan 10 tane arkadaş kalması olayı pek hoş birşey değil. değer mi diyorum bazen ama eninde sonunda gireceğim bir yoldu, iyiki erken davranmışım. çocuğum olursa hiçbirşeyi kaçırmasına izin vermeyeceğim ama en geç 23-25 yaşında bir iş sahibi olabilmeli, en azından birşeyde uzman olmalı.",21.11.2015 20:04
endemikdavar,1225362,iki kızına tecavüz eden baba,4969783,56396066,"egede boyle seyler normaldir diyen, kesin mugladir diyen insanlarin kesinlikle tedavi gormesi gerekmektedir. ilden ile degisiyor mu kardesim normalite ? olay normal degil, sehir nasil normal gelir, hangi kafayi yasiyorsunuz ?tum bunlari bir yana birak( birakamiyorum ama ) egeye gelmeyin derken de bunu kastediyoruz hep. gelmeyin, yozlastirmayin, cunku benim dogup buyudugum egede tamam capkin adamlar vardir ama asla evladina oyle bakacak adamlar yoktur, karisi tarlaya gidince 27 ve 17 yasindaki kizlariyla evde kalacak adam da yoktur neden derseniz hepsi birlikte tarladadir da ondan. mumkun olsa da kimligini acik etseler boyle insanlarin hatta kutugune kadar ifsa etseler. umarim en agir cezalari alir.",21.11.2015 09:54
endemikdavar,1225362,dili bilinmediği halde hüzünlendiren şarkılar,4831375,56395817,bebe - siempre me querada,21.11.2015 09:30
endemikdavar,1225362,bir erkeğe yara izinin hikayesini sormak,2828240,56384091,"bence sormayın. çünkü sorunca, ailesinin eski kız arkadaşıyla evlenmesine şiddetle karşı çıktığı için gemileri yakıp, alkol dozajını aşıp, o halde hız yapıp arabayla uçurumdan uçup aylarca hastanede kaldığını bu yüzden hala sol elinde ufak çaplı his kaybı olduğunu öğrenebiliyorsunuz. sevgilinin doğrucu davutu da hiç çekilir dert değil.",20.11.2015 17:51
endemikdavar,1225362,ders notlarını arkadaşlarına vermeyen öğrenci,913474,56377965,"kesinlikle hakli olan ogrenci, ikinci ogretim okudum hem calistim hem essek gibi okula geldim, not tuttum. aksama kadar kampuste kafelerde totosunu buyutmus ya da yurt odasindan cikmamis arkadas gelip not istiyordu. arkadasim onemli isin olur anlarim, hasta olursun anlarim ama benim ozel durumum olup, okula gelemedigim donemlerin notlarini bana vermeyip benden aldiklarini da birlestirip ganoyu yukseltiyor(dun)sun.",20.11.2015 12:56
endemikdavar,1225362,babaanne yeleği,4564584,56376469,"babaannemde de anneannemde de vardi bunlardan, ucsuz bucaksizdilar sanki, hep seker, ve paralar olurdu bu ceplerde, digerinde mendil. simdi annemde giyiyor, evden cikarken sekerlikten seker atiyor cebine yolda cocuk gorursem veririm diye. hic bitmesin boyle seyler.",20.11.2015 11:32
endemikdavar,1225362,yirmi yaş dişi,440318,56374406,"soylendigi gibi 20 lik falan degil cunku hala cikiyorlar, ust dislerim daha buyuk oldugundan onleri bozamadi ama sanirim altlari bozdu, keske onceden gidip cektirseydim. birde hayatimda 1 kez disciye gittim allaha sukur butun dislerim saglam ama sadece bunlar curuk goruntulu, digerleri ile ayni boyda d degiller, neden acaba ?",20.11.2015 09:47
endemikdavar,1225362,nescafe içmeyen insan,4289646,56361552,"herkes belirtmiş zaten nasıl bir kimyasal olduğuna tekrar değinmenin manası yok yalnız granül kahve içmeyen insanı illaki havalı starbucks menülerinden içiyor zannetmek niye ?, mecbur kalmazsam starbuckstan kahve içmem, 10 liraya french press satılıyor, ha onu da beceremiyorsanız, kağıt filtreler var ofisinizde çekmecenizde muhafaza edebileceğiniz. ya da üçü, ikisi,teki bir arada karıştırmaya devam edebilirsiniz.",19.11.2015 18:01
endemikdavar,1225362,stockholm uçağında namaza duran yolcular,4968482,56360155,"madem dinlerine bu kadar bağlılar, vecibelerini yerine getirme taraftarılar, aklımda iki soru var ;1. kıbleyi nereye aldılar ?2. kaza namazından neden haberdar değiller ?",19.11.2015 16:54
endemikdavar,1225362,nescafenin kahvesini koyarken eklenen son pinçik,4968783,56360025,"aramızda hala granül kahve içen fakirler var. şaka şaka için ama ona kahve demeyin, ham petrol o.",19.11.2015 16:47
endemikdavar,1225362,aileyi arsa satmaya ikna edememek,4968493,56357889,"ben de babamı satmamaya ikna edemiyorum, adam ufak ufak derken epeyce bir miktarı yedi. en son vukuatı 60.000 tl ye traktör aldı, buraya kadar sorun yok gibi ama biz tarım yapmıyoruz. evin önü galeriye döndü ama tek kullanan kendisi. durduramıyoruz. toprak satışına karşıyım.",19.11.2015 14:57
endemikdavar,1225362,kişisel gelişim kitaplarının tek cümlelik özeti,4341441,56350628,"insan esmer ve uzun boylu olabilir ama yine de aglayabilir, cokta seyapmamak lazim.",19.11.2015 07:13
endemikdavar,1225362,sabah kahve içip spor yaptıktan sonra işe gitmek,4961991,56350595,"sabah spor yapip ardindan kahve icerek ise giden gruba dahildim son 3 yildir. sehir degistirince park yalan oldu tabiki. yataktan cikana kadar zorluyor ama sonrasi nese, mutluluk, enerji. aksamlarin size kalmasi da cabasi.",19.11.2015 07:07
endemikdavar,1225362,yonca evcimik denince akla gelenler,3122504,56350456,"oktay (bkz: cenk torun), ortaokuldaydim herife asiktim, 30 yasina bikac yil kaldi herif hala ayni. hos yonca evcimik de ayni, ne iciyo la bunlar ?",19.11.2015 06:25
endemikdavar,1225362,yok yere gittin canımın içiydin,4966929,56350451,"bence komik, ozellikle ikinci yapilan market gibi biryerde cekilmis olan videoda sakalli elemanin kopmasina baya guldum(ne seker bir adam), tamam belki haftaya guldurmeyecek ama komik :)",19.11.2015 06:23
endemikdavar,1225362,vasat olan çocuğu ısrarla okutmak isteyen ebeveyn,4967268,56338746,"bence doğru yapan ebeveyndir. en yakınım halamın torunu var bu şekilde, ortaokuldan sonra bıraktı okulu, babası klasik demek bırakıyorsun haydi bakalım sanayiye dedi. şuanda 19 yaşında, geçen sene yerel gazetede çıkınca gördüm arabayla denize uçmuş sabahın dördünde. yazın görüştük abla beni de aldırsana yanına diyor, neden ? çünkü pişman olmuş yaşadığı hayattan. anne babası biraz daha zorlasaydı ne bileyim bir şekilde teknik liseye girip meslek öğrenseydi aklı başına gelince bir şekilde yüksekokul deneyebilirdi ya da turizm lisesine gitseydi dil öğrenip bir yere kadar standart yazlık işlerde çalışıp farkına vardığı zaman daha başka pozisyonlar için kasabilirdi. çünkü gerçekten bir yaştan sonra farkın varıyorlar nasıl hata ettiklerinin.ha bir diğeri de nişanlım, aile varlıklı gerçekten okumak istese her türlü okutabilecek maddi durumları varmış ama o okulda öğretmeniyle kavgaya tutuşmuş ve o öğretmen de bunu tekme tokat dövdüğü için bir daha okula uğramamış. ve şimdi öğretmen kelimesinden bile nefret ediyor. benim vardığım kanı, çocuğun zekası ya da ailenin durumu değil, öğretmenin konumu bu işte çok önemli. karakter sağlam ise benim gibi parmaklarını birleştirip tahta cetvelle cezalandırılma travmasını atlatabilirsiniz ama karakteri henüz oturmamış çocukta daha o yaşta sistem sorgulamasını yaşatabilirsiniz.",18.11.2015 18:17
endemikdavar,1225362,leyla zana'nın kesinlikle yemin etmeyeceğim beyanı,4967227,56337620,leyla zana'nın yemini anayasa maddelerini okuyuncaya kadardır.,18.11.2015 17:19
endemikdavar,1225362,adı ç ile biten erkeklerin yavşak olması,4967639,56334638,"meriç.iy kalpli, sevecen görünüp böyle yavşak olan başka bir insan görmedim. adam evlendi, evlenmedim diye aradı, çocuğu oldu yok öyle birşey ben seni seviyorum diye aradı, olm bak arkadaş olarak sana değer veriyorum ama şuanda nişanlımla yemek yiyorum dediğim gün gizli bir hastalığım var çok az ömrüm kaldı kimseye söyleme ama seninle görüşmem lazım dediğinde artık sektir git dedim. gitti mi ? hayır. birşekilde yine beni bulabiliyor, nasıl anlamıyorum.",18.11.2015 15:02
endemikdavar,1225362,10 sterlinin 43 lira olması,4967606,56327027,"nişan merasiminde (çok saçma ama mecburdum) görümcem tarafından takılan miktar. saklıyorum, saklıyorum ki onun özel gününde aynısını geri iade edicem. türküz pound ne alaka bu bir, ikincisi 43 lira ne lannnn ???",18.11.2015 05:33
endemikdavar,1225362,kadınlardan kadınlara tavsiyeler,2594363,56288912,"bütün erkekler size hastaymış gibi davranmayın, nişanlanan, evlenen insanlar için ay bu bile evlendi demeyin hadi dediniz ben neden evlenemedim diye kendinize sorun muhtemelen cevabı bulamayacaksınız çünkü kibirinizin hemen arkasında cevap. önünüze gelen her erkekle yatmayın, tamam özgür bireyleriz hepimiz istediğimizi yaparız ama sonra o bile evlendili cümleler kurarken bu aklınıza gelsin. yattığınız adamları da kız arkadaşlarınıza anlatmayın, kimin nesi küçük nesi büyük neresinde kıl var sevişirken nasıl ses çıkarıyor gerçekten bilmek istemiyoruz. kıllarınız için lütfen lazerli çözümler arayın, bir sürü kampanya yapan yer var, kozmetiğe ağdaya ayıracağınız paraya denk. incecik dudaklarınızı kalın göstericem diye büzmeyin aklıma türk filmlerindeki fahişe rolleri geliyor. içip içip sapıtmayın, sonra taksiciye araba yıkaması için eksta para veren yine en yakın arkadaşınız, onu rezil ettiğiniz yetmezmiş gibi birde parasını geri ödemiyorsunuz çünkü hatırlamıyorsunuz bok var o kadar içecek.burdan bütün kadınlar böyle diye çıkarım yapmayın, etrafımda var böyle birkaç tip kafasını duvara duvara vurup akılların başlarına getirebilsem keşke.",16.11.2015 15:59
endemikdavar,1225362,kahve içersen arap olursun,72448,56279570,"arap demek, kelime anlamiyla guzel demektir, siyah tenli demek degildir. kahve icersen arap olursun degil, kahve icersen kararirsin denir. sebebi kahve bagimlilik yaptigi icin cocuklarin icmesini onlemek amaciyla koyu renkli bir icecek oldugu icin kararmak tabiri kullanilir. hemen irkcilik, fiti fiti duyar kasin.",16.11.2015 07:52
endemikdavar,1225362,şampuan reklamında türbanlı genç kız oynatmak,4965868,56279528,"kina gecesinde nasil savuruyorlar, gerdek gecesi olmasin o ?",16.11.2015 07:45
