username,userId,entryTitle,entryTitleId,entryId,entry,entryDate
endemikdavar,1225362,karaköy'deki mekanların götlerinin kalkması,4905408,54591947,"diğer içecekler ve yemekler tartışılabilir ama bence çay konusunda haklı olabilirler. 2000 yılında deniz kenarında bir mekanda komilik yaptım, mekan 3 bölümden oluşuyordu içeceklerin ve ufak arıştırmalıkların servis edildiği bölüm, öğle yemeği ve akşam üstü içkili ara sıcaklı bölüm ve bir diğeri akşam yemeği olan bölüm, akşam yemeği bölümüne geçene kadar 2 ay sadece çay taşıdım hem de tepsi tepsi çay öyle 8 lira filan da değildi 25 kurus filan olabilir o zamanlar emin değilim ama bu mekanın bölümlere ayrılmadığını ve akşama kadar parsellenmiş masalara sadece çay sattığını düşünebiliyor musunuz ? çalışan mutfak dahil 20 kişi var üstelik, çay satmayla maaşlar nasıl ödenecek ? yukarıda bir arkadaş belirtmiş başka ürünlere yönlendirmek için çayın fiyatını yüksek yazıyorlar diye, işletmeci açısından gayet mantıklı bir davranış çünkü servisi alan değil veren olsaydınız insanların ne kadar çay içtiğine hayret ederdiniz. o zamandan kalma psikoloji belki bilmiyorum bir mekana gidersem en az kahve içerim, çayı da beğenirsem yemekten sonra en az iki tane içerim ki bu caylar zaten ikramdır bizim oralarda.",06.09.2015 19:50
endemikdavar,1225362,börek açamayan kadın evde kalmaya mahkumdur,4905052,54571959,tanım : geçen haftanın konusu.,05.09.2015 21:05
endemikdavar,1225362,dış görünüşün her şey olduğu gerçeği,4208468,54566080,başka bir başlıkta söylemiştim tekrar söylüyorum dış görünüş önemli değildir buna örnek olarak scarlet jhonson un kopyası bir kızın evlendiği ve dış görünüşü sünger bob olan evet bildiğiniz fiziğiyle sünger bob'u andıran kare formdaki iş arkadaşımdır.,05.09.2015 16:22
endemikdavar,1225362,sinirlenmek,70349,54563742,"benim bir aydir ustune basa basa hergun anlattigim seyi sanki ben soylememisim gibi gelip az once bana satmaya calisan mudurume karsi besledigim hisler yumagi. kafamin icindeki damarlarin yeri belli suan, cizz cizzz.",05.09.2015 14:08
endemikdavar,1225362,aşk-ı memnu'dan akılda kalanlar,2449044,54563553,""" sen bihter ziyagilsin,aptallik etme """,05.09.2015 13:55 ~ 14:12
endemikdavar,1225362,öğrenim kredisi geri ödemesi,725512,54560801,"babam sagolsun dedigimdir. -baba ogrenim kredisi cekicem kagitlari imzalar misin ?-ne kadar ?- aylik 130( du sanirim o yillar)- ne geregi var ben sana aylik o kadar para gondermiyor muyum ?himm adam hakli bu para icin degmez, ise baslayinca da fazlasiyla aliyolarmis, en iyisi cekmeyeyim dedim. babam para gonderdi mi ? tabiki hayir. ikinci ogretim okudum, gunduz ise gittim. okul bitip fulltime ise girince maaslarinin yarisini ogrenim kredisine yatiran arkadaslarimi gorunce "" thanks daddy"" dedim.",05.09.2015 11:14
endemikdavar,1225362,ibrahim tatlıses'in milletvekili adayı olması,1655596,54559288,"aksam aksam sinirlerimi tepeme cikaran haber, neden mi ? abi biz bosuna okuduk diyorum, adam olabilmek icin ne cok cabaladik, 50 lira zamlar aldik ezildik yillarca adam turku soyluyor ok soylesin ama adam ilk okul diplomasina sahip. meshur oldugu yillarda muzigi tutulmus, meshur olmus ok ama bu ne ozguvendir ? alin cocuklarinizi okuldan baglama kursuna yollayin, sonra o ses turkiyelere katilsinlar.",05.09.2015 08:05
endemikdavar,1225362,trabzon sahilinde yatıp ölen çocukla empati kurmak,4903535,54536338,"sahilde yatiyosun, uyuyosun, uyumak tatli geliyor ama ishal oluyorsun farkinda degilsin.",04.09.2015 09:02
endemikdavar,1225362,dukan,1687996,54536041,"daha once 1 aylik denemelerle en az 4 kez denedigim diyet sonrasinda biraktim cunku meyve yemeden yasayamiyorum. cocuklugumdan beri evdeki butun meyveleri silip supurdugumden annemin seni manava verecegim demelerine maruz kalmis bir insanim. diyetisyene de gittim, bana "" e sen hicbirsey yemiyorsun ki ben sana ne yazayim diyet listesi ? "" demesine de maruz kaldim cunku baklava, yogun cikolata, fastfood ve icinde ne oldugunu bilmedigim disarda yapilmis abuk sabuk seyleri yemem, seker kullanmam, ekmek yilda 20 gun turkiye tatilim haric yemem cunku evde yapilan hersey ekmekle yenecek seyler. neyse ayni doktor meyveyi azaltmalisin cunku o kadar meyve yersen alkol kadar zararli sana icinde meyve sekeri var ve sen asiri tuketiyorsun dedi. tabiki ben yine sallamadim cunku yine etrafimdan aman meyve yani ne olacak laflari duydum ve bunlara inandim. neyse efenim turkiyeden tekrar +5 kilo donunce(83.7), arkadasimin uyguladigi doktorun her hafta degistirdigi listeyi uygulamaya karar verdim ama arkadas o nedir oyle 7/24 yiyosun ac olsanda olmasanda yiyeceksin ve meyve de var aladim tabi 1.5 ay yaptim ve 1.5-2 kg verebildim ve tabiki eeeeh dedim baska bir cozum lazim ve tekrar dukan'a yoneldim 27.07.2015 tarihinde 3 gun atak uygulayarak sonrasinda 1 gun sebzeli protein, 1 gun sadece protein olarak uygulamaya basladim. beni en cok kasan sey diyetin kendisi cunku et yerken midem bulaniyor, balik yerken olmuyor ama tavuk ve kirmizi et yerken aklima kotu kotu seyler geliyor ve zorla yiyorum zorla yedigim icin az yiyorum, 10 yildir kola icmem ama kofte yedigim gunler mecburen iciyorum. sabah ekmeksiz peynir mide bulandirabiliyor ve zaten ben sabah kalkar kalkmaz birsey yiyebilen biri degilim bu yuzden genis bir fincana 3 kasik yulaf kepegi, 1 yumurta, peynir kabartma tozu koyup kuru kalirsa biraz suzme yogurt ekleyip 4 dakika mikrodalgaya atiyorum ve tuzlu bir kek oluyor, buzlukta biraz sogutup isyerine goturuyorum ve nam nam nam yiyorum oglene kadar. ogleden sonra arasi icinde buyuk boy soguk latte aliyorum ise donerken ve onu bikac saat elimde gezdiriyorum aksamustu acikirsam ki aslinda acikmadan degil sigara ictigim icin sigaranin tadindan kurtulmak icin sakizlar ve goji berry tuketiyorum, kitapta bir avuc demis ama ben bikac avuc rahat yiyorum. aksam eve gidince activanin sifir yagli erikli olanina bayildigim icin onu normal yogurtla cogaltip yiyorum ve sindirdikten sonra yuzmeye gidiyorum, havuzda hic durmadan 10 tam tur atiyorum ama ne hikmetse yarim saat suruyor, masa basi calisani oldugum icin 10 gidis klasik kurbaga bacaklari calistirmak icin diger 10 donuste sirt ustu yuzuyorum. sonra eve gelince az ac isem keci yogurdu tuketiyorum( keci yogurdu bagirsaklari calistirir) cok acsam sabah yaptigim karisima tuzsuz ricotto peyniri ve splenda ve tarcin ilave ederek tatli bir kek yapip onu yiyorum.sonuc 39. gunumdeyim, basta soyledigim gibi 83.7 nin 1-1.5 kilosunu arkadasimin diyetiyle vermistim ama dukan'a basladigim gun moralim bozulmasin diye tartilmadim o yuzden 83.7 i baz aliyorum ve bugun itibariyle 75 kiloyum. bugune kadar yaptigim diyetlerde max 73 e kadar inebilmistim( spinning,pilates,yuzme,kosu( gunde 10 km) hepsini denememe ragmen. olmam gereken kilo 65 yani daha 10 kilom var, bu sefer pes etmeyecegim galiba bakalim zamanla editlerim.sevgiler.29.09 editi ; bu sure zarfinda yulaf kepegini fazla tukketim biraz kacamak yaptim, kacamak dedigim bir donutun tadina bakmak, uc bes uzum yemek ve son olarak iki bardak taze meyve suyu icerek. cunku tum gun kahve icmekten carpintim baslamisti, bu diyetin en kotu yani sosyal hayati bitirmesi ama yinede guncel kilo 73.7 . kayip 1.3 kg.",04.09.2015 08:28 ~ 29.09.2015 08:37
endemikdavar,1225362,ankara'daki satılık 27 bin liralık daire,4903677,54516843,"suanda bunun aynisi buyuklukte bir eve turk lirasi ile 1400 tl kira veren beni sasirtmamistir, yukarida bahsedildigi gibi 15-20 min masraf yaparak cok guzel bir yere donusturulebilir, masrafinizi 1 yilda cikartirsiniz, hatta airbnb den kiraya verebilirsiniz. eger soylendigi gibi ankaranin gobeginde bir yer ise dusunun derim.",03.09.2015 14:06
endemikdavar,1225362,yaşlanmayan kadınlar,1265936,54516695,"cildinizin erkenden yaslanmasini istemiyorsaniz malak gibi gunesin altinda yatmayin annem 65 yasinda ve teni mis gibi, ne sarkik ne kirisik neden cunku karpuz gibi gunesin altinda yatip marsik gibi yanmamis hic.",03.09.2015 14:00
endemikdavar,1225362,starbucks reserve,4903069,54513392,gun gecmiyor ki kahvesi berbat olan starbucksla ilgili baska bir konu acilmasin. ne yani kopi luwak mi servis edecekler ameke .,03.09.2015 11:27
endemikdavar,1225362,şehirlerarası otobüs yolculuğu klişeleri,2147463,54509961,"birgun gercekten ama gercekten katil olmama sebep olacak sekilde yanimda, onumde, arkamda oturan kisinin cinsiyet farketmeksizin cakkidi cakkidi sakiz cignemesi. abi bu sakiz nedir ya nedir agzindaki kotu tadi/kokuyu gidermekten baska, neden oral seks yaptiriyorsun o sakiza. cignemeyin de demiyorum be hayvanlar kapatin su agzinizi.",03.09.2015 07:34
endemikdavar,1225362,acıktıran film sahneleri,4902878,54509794,"(bkz: chef) et yemekten hazzetmiyorum ama herifin filmin bir yerinde aldigi ozel etler vardi, valla denemek isterdim ne yalan soyleyim, hele mexican sandvic'i.",03.09.2015 06:43
endemikdavar,1225362,izlandalıların suriyeli mültecilere evini açması,4901700,54490529,"izlanda hatirladigim kadariyla intihar olaylarinin en fazla yasandigi ulke, toplu depresyona falan giriyorlardi havasindan dolayi. yani herhangi bir multecinin siginmak isteyecegini sanmam.",02.09.2015 13:58
endemikdavar,1225362,sana margarin rezaleti,4902142,54490343,"icinde ne oldugunu bilmediginiz seyleri yemeye devam etmeniz gerektigine dalalettir, bakin mis gibi protein, asyada karinca yumurtasinin fiyatini bilseniz hic ziyan etmezdiniz.",02.09.2015 13:50
endemikdavar,1225362,bir oturuşta 1 kilo fındık ezmesi yemek,4902221,54489727,1 kilo yenmez tabiki ama bir kavanoz fiskobirlik findik ezmesi olsa yariya indirebilirim.,02.09.2015 13:23
endemikdavar,1225362,sevilen şiirin en vurucu cümlesi,3679333,54488903,""" aysel git basimdan ben sana gore degilim""",02.09.2015 12:47
endemikdavar,1225362,ev yapacaksan tuğladan kız alacaksan muğla'dan,382491,54484658,"birtane muglali da cikip cevap vermemis. ev yap tugladan, malumunuz saglam bir malzeme olan tugla olmasinin yani sira muglada evi olmayana kiz vermezler ve tum ceyizi a dan z ye kiz tarafi alir, baska sehirlerdeki gibi yatak odasi senin mutfak benim oturma odasi enistenin tartismasi yoktur. o sebepten git evini tugladan guzelce yap zaten muglali kiz alinca ici otomatikman dolacak diyor.",02.09.2015 09:08
endemikdavar,1225362,genç kızın ahlak ve namustan büyük çeyizi olamaz,4901879,54484598,beni cok sevindiren haberdir. bu sekilde ceyiz masrafindan kurtuluyoruz degil mi ?(bkz: ev yapacaksan tuğladan kız alacaksan muğla'dan),02.09.2015 09:01
endemikdavar,1225362,sevgilisine kahve yapan erkek,2148363,54484425,"benim sevgilimdir. ikimiz de kahve manyagiyiz, aksama kadar kahve icme potansiyelimiz mevcut.iliktir, gavattir, toptur demis birileri cikip sizi bilmem ama evlenilecek erkek oldugu kesindir. baldir o bal.",02.09.2015 08:41
endemikdavar,1225362,küçük bir kafe açma hayali olan insan,4891990,54484383,"belki bir fikir olur diye bu basliklara bakiyorum lakin herkes soyle batarsin boyle batarsin demis. birisi de cikip dukkan kirasini dahil etmeden min 6 max 10 masali kucuk bir bakery cafenin maliyetini yazsa ya. malzemeler, izinler dahil ama, malzemede ucuza ya da en pahaliya kacmadan ahsap masali ya da berjer koltuklu sehpali. gercekten kahve icilip yaninda hamur isi, sandvic yenecek bir yerden bahsediyorum. hadi goreyim sizi.",02.09.2015 08:37
endemikdavar,1225362,vayamk,2598492,54464920,tanimadan seviyoruz kendisini ama sekerli pisi yapip yedigime dair soylentiler gercegi yansitmamaktadir.,01.09.2015 13:30
endemikdavar,1225362,1 eylül 2015 ipek grubu'na polis operasyonu,4901323,54464301,"fuat avninin dedikleri bir bir cikiyor, bence herkes kendine yeni bir ulke bakmaya baslasin ama asya'yi secmeyin zira su siralar bombaci diye adimiz cikti 9 a inmez 8 e.",01.09.2015 13:00
endemikdavar,1225362,zengin koca arayan kadın,2756751,54462283,"akliyla da fizigiyle de prim yap(a)mayan kadindir. tanidigim butun zayif hatunlar normal evlilikler yaparken sismanlar zengin koca ariyor. hayir kayserili is adami filan aramiyorlar bildigin ilik gibi cocuklara bakiyorlar ustune ustuk. akliyla yapsa yine anliycam, sismansin ama sempatik degilsin iticisin ve hala beklentin ust seviyede.",01.09.2015 11:22
endemikdavar,1225362,gopro kamerasıyla metro treni üstünde giden genç,4901065,54460155,ukranyalilastiramadiklarimizdan misiniz ?ayrica tum bu gariplikler neden ukrayna ve rusyadan cikiyor yillardir iclerindeyim anlamadim.,01.09.2015 09:14 ~ 09:15
endemikdavar,1225362,rusça bilmeyen erkek,4901246,54459682,"en azindan davai, domoy diyebilmebi.",01.09.2015 08:33
endemikdavar,1225362,mutsuzluğun asıl sebebi,3735321,54444775,kendini sevmemek. koca kafalıysan koca kafamdan dolayı de mesela şişmansan yavru fil olduğumdan de bu şekilde insanlar seni kıramaz çünkü zaten farkında olduğun birşeyin dalgasını geçemez seni incitemezler.,31.08.2015 17:22
endemikdavar,1225362,sırtüstü uyuyabilen insan,4205437,54441124,tam olarak koala gibi uyuyabildiğim için kesinlikle anlamadığım insandır. ve beni hamilelikte en çok korkutan şeydir muhtelen çıldırıcam uykusuzluktan.,31.08.2015 14:55
endemikdavar,1225362,sözlük yazarlarının zenginlik kıstasları,3971300,54436970,"evi, arabasi, ailesi olan ve duzenli isi olan insan zengindir. duzenli isten kastim masa basi da degil, ciftci de olabilir, pazarci da. kredi karti da dahil hic borcu olmamasi kaydiyla, o adam yolunu bulur.",31.08.2015 12:01
endemikdavar,1225362,deliksiz uyku,182547,54433465,yillardir hasret kaldigim uyku.,31.08.2015 08:57
endemikdavar,1225362,anneanne evindeki 30 kiloluk beton yorgan,3081994,54423250,"bizim evde hala olan yorgandır, içine girince buz gibidir ilkokulda öğrendiğin kinetik enerjisini dener içinde biraz debelenir ısıtırsın kendini, üstünden kaymaz, sabah sıcacıktır, çıkamazsın içinden.",30.08.2015 21:45
endemikdavar,1225362,yahudilerin bu kadar zengin olmasının nedeni,4326857,54423123,"akıllı olmalarındandır. sana tohum satarlar sen bir güzel alırsın oh ne güzel ürün verdi çekirdeklerinden ayırayım seneye de ekerim dersin keser bakarsın, içinde tohumluk çekirdek yok. öbür sene yıl paşa paşa parasını öder yine hazır tohum alırsın.",30.08.2015 21:41
endemikdavar,1225362,kadın börek yapmasını bilmiyorsa o aile dağılır,4900070,54421014,kadın girişimcilere gün doğmuştur.. derhal işi gücü bırakıp göz göz gözleme dükkanı açıyorum umarım sevgili bakanımızın bu sözüne istinaden kagiderden kredi alabilirim.,30.08.2015 20:04
endemikdavar,1225362,düğünde ilk dans için en nefis şarkılar,453595,54419504,"ilk dans ne abi ben anlamıyorum yüzlerce kişinin önüne çıkmışsın romantiğe bağlayamıyorsun min 4 dakika partnerine sarılıp sallanıyorsun, özel yemeğe çıkarsın dans et arada öp kokla sarıl ama düğündeki ilk dans olayını özellikle ferhat göçer şarkılı filan anlamıyorum sırf bu sebeple zeybekle çıkıcam ben, dans kareografi önemli bunlar 4 dakika niye sallanasın hüzünlü bir şarkıda ?",30.08.2015 18:43
endemikdavar,1225362,ingilizcedeki en güzel kalıplar,2596918,54419073,same shit different day,30.08.2015 18:19
endemikdavar,1225362,manita feyslerinin nişan düğün fotosu dolması,4899796,54413826,"hazırlıkta platonik aşık olduğum, hip hopçu, saçını dönemin modası olan havuz modeli yapan çocuğun evlendiğini üstüne baba olduğunu gördüğümden beri hiçbirşeye şaşırmıyorum, olm o değilde daha kaç sene önce döner almaya yetmeyen paranı denkleştiriyoduk sen ne ara aile reisi oldun ? hoş rapçi olan bir diğer arkadaşımın studio ortamında çektirdiği nişan resimlerinden sonra şaşırmam artık diyordum ama bunda gerçekten şok oldum.",30.08.2015 13:47
endemikdavar,1225362,kırkılmamak için 6 yıl mağarada saklanan koyun,4899616,54410729,kırklanmak için diye okuyan yalnızca ben miyim ?,30.08.2015 10:32
endemikdavar,1225362,orkid kullanan erkekler,1781325,54410709,"orkid diye markalaştırmayalım, molped de olur ve bütün profesyonel yürüyüşçüler kullanır. topuğuna peçete koysan terden sürtünmeden dağılır, ayakkabılar sadece kadınların topuğunu vurmaz.",30.08.2015 10:30
endemikdavar,1225362,koğuşta biri orkid'imi çalmış diye bağıran asker,4899768,54402061,"asker bot giyer, bot topukları vurabilir, botun vurdugu topuklara ikiye bölünmüş ped yapıştırılıp bot giyilebilir. illaki normal ped olmak zorunda değil hafif vuruklarda günlük ped bütün olarak iş görür.",29.08.2015 22:25
endemikdavar,1225362,kek yapacaklara tavsiyeler,3523449,54400748,kabartma tozunu bütün malzemeleri çırptıktan sonra ekleyin ve karıştırın.,29.08.2015 21:32
endemikdavar,1225362,tayland bombacısının türk çıkması,4894433,54399505,adamın evinde 20 tane pasaport bulunmuş ama sadece türk olan yayınlanıyor üstelik ben sahteyim diye bağırdığı halde. istanbul yerine iştanbul yazıyor. medya heryerde aynı.,29.08.2015 20:31
endemikdavar,1225362,depresyon yastığı,811494,54395045,"doların 3 tl ye ulaştığı şu günlerde bu yastığa 430 usd verebilecek bir depresyon sahibi yoktur, verse daha çok girer.",29.08.2015 16:20
endemikdavar,1225362,squat yapan türk kızı,4152813,54394282,"60 kilo üstü yapmasın dediğimdir, nereden mi biliyorum ? çünkü 70 kiloyla 1 ay squat challenge sonucunda pantolonlarıma sığamadım efenim, ne kilo aldım ne bişi, kilo aynı ama pantolonlar bildiğin popo kısmından dar yapıştı üzerime neyse bıraktımda şimdi rahat rahat sığıyorum.",29.08.2015 15:33
endemikdavar,1225362,debe listesindeki anlamsız kadın yazar artışı,4899086,54393182,"oylayanlarin yarisindan fazlasinin caylak oldugunu goz onunde tutarsak "" 155 adet caylagin derdine derman olmus, bak kardesim isin ozu o degil cunku soyle diye anlatmak isteyipte aman yazsam kimse okumayacak zaten bak hazir bir yazar derdime derman olmus basayim sukelayi "" dedigi icindir. 155 caylagin hepsi yazar olsa eminim hic biri oturup bir saat yazmayacak oraya ama caylakken icinden deli gibi yazma, cevap verme, o oyle degil asil soyle deme hissi geciyor insanin icinden. bu facebook "" yilmaz ozdil yazilari"" gibi aslinda, vaay be tam dusundugum seyi yazmis, begeneyim ve paylasayim olayi.",29.08.2015 13:47
endemikdavar,1225362,davul zurnayla gelin alma kıroluğu,4899057,54392910,"her kusu yakaladiniz bi leylek kaldi, gun boyu trafik, insaat ve bilimum baska gurultulere maruz kalan sehirli (?) arkadaslarimizin hosuna gitmemis. -nerelisin ?+ ıstanbul.-yani ? annen baban nereli ?+....sey annem antepli babam kayserili ama ben dogma buyume istanbulluyum.sabaha kadar site bahcesinde dugun yapsalar, halay cekseler anlarimda max 1 saat suren olaya ne diye bok atiyorsunuz ? ben gelin olsam ben de istemem cunku bunun icin sabahin korunde evden cikip kuafore gidip baba evine geri donup hoop ordan tekrar dugun yerine gitme olayi var, zaten yolculuk yapinca uyuyan bir tipim kimse benden dugunde oynamami, hadi oynadim diyelim o gece sevismemi beklemesin. yapmayin tamam ama yapana da karismayin.",29.08.2015 13:34
endemikdavar,1225362,mango kurusu,2754388,54391862,sekerleyip kurutmasalar en sevdigim sey olabilir o yuzden tazesini tercih ediyorum.,29.08.2015 12:42
endemikdavar,1225362,galatasaray'dan neden bu kadar çok nefret edilmesi,4898407,54391842,"nefret demeyelim de cocukken galatasarayli olan yasitlarimin yani okuldaki cocuklarin hepsi saldirgan belki biraz kilolu ve hani ilk okulda kilolu kiza sisko,ayi, disleri dokulene fare diyen arsiz cocuklardi. o zamanlar galatasarayli olmanin bu karakteri sart kostugunu dusunurdum belkide bu yuzden fenerbahceliyim, yani bana suan gozlerini kapat ve galatasarayli bir cocuk dusun deseniz aklima gelen resim bu.",29.08.2015 12:40
endemikdavar,1225362,amerikalı kız rakı içerse,4899033,54391513,"rakiya direkt buz atilmaz kristallesir, ayrica bunca yildir raki icerim ne kendim ne etrafimdaki kimse bu kadar delirmedi. (bkz: arap sen icme, sen icince bokunu cikariyosun) ayrica raki icen kadin soyledir boyledir diye diye sisirdiniz de sisirdiniz. raki icen kadin matah bisi degil, onemli olan o masaya oturdugu gibi kalkan kadin/erkek.",29.08.2015 12:22
endemikdavar,1225362,fethiye müzik köyü,4849188,54390243,"memleketim diye soylemiyorum cok gurur duydum, soz konusu fethiye olunca zaten sovanist damarlarim ortaya cikiyor bu tuz biber oldu birazdan istifa edip aksam ucagina binebilirim.",29.08.2015 10:59
endemikdavar,1225362,kıdem tazminatı,229695,54388878,"kafami son zamanlarda oldukca mesgul eden durum, eger dayanabilirsem 31.03.2016 yi son is gunu olarak planliyorum. ancak soyle bir durum var tazminatimi da istiyorum. su sekilde ; 1. 2016 yaz sonu evlenmeyi dusunuyorum, yurtdisinda yasiyor/calisiyorum, turkiye'de sigortam var. 2. 2016 yaz sonu evlenmek icin sezonun bittigi nisanda ayrilmam gerekiyor, bilemedin mayis. 3. evlilik tazminati evlendikten 1 yil sonraya kadar aliniyormus yani bunun icin isten ayrilmadan once evlenmem gerek, evlenmek icin turkiye'ye donmem gerektigini goz onune alirsak, evleniyorum diye ayrilirken tazminati alma sansim nedir ? cunku bunun hazirligi var, esyasi var yani uc bes ay erken donmem lazim. 4. maasimin % 40 i turkiyeden yatiyor, kalanini usd uzerinden yasadigim ulkeden aliyorum, kidem tazminati hesaplanirken sadece turkiyede yatan paradan mi hesaplanacak, yoksa sirketin insiyatifinde mi ?5. onceki aylarda isten cikarilan arkadaslarim ( 3 yillik personel) 40 bin tl seklinde tazminat aldilar, turkiyede yatan maas uzerinden alsalardi sistem hesaplamalarina gore 18-20.000 tl tutuyordu. bilenler aydinlatirsa sevinirim, nikahi kiymadan evlilik tazminati alma sansim nedir ? yoksa yaban ellerde konsoloslukta ugrasmak istemiyorum ve dugunde evet demek istiyorum, ne olur ne olmaz dimi.",29.08.2015 08:40
endemikdavar,1225362,türkiye'ye geri dönmek,492951,54388656,"benim icin farkedip farketmeyecegini merak ettigim eylem, keske bir demo gosterseler ona gore karar versem. ama huzur asyada degil, avrupada olmasi mantikli.",29.08.2015 07:42
endemikdavar,1225362,hayatında hiç lynchburg lemonade içmemiş kadın,4898950,54388592,"hayatindan hicbirsey eksilmemis kadindir. votkaya portakal nasil yakismiyorsa viskiyle de oynamasinlar, icine kola kattiniz bisi demedikte sirf bardaklari, rengi guzel diye olup bitmenin manasi yok. iyi yapim( zeytinyagina benzemeyen) limonchello icin onun yerine.",29.08.2015 07:16
endemikdavar,1225362,ortalık karışınca kefenlilerin ortadan yok olması,4898182,54367607,(bkz: safak sezer),28.08.2015 12:19
endemikdavar,1225362,balığa limon sıkılır mı sorunsalı,470614,54367472,"bizim oralarda baliga limon sikilmasiyla ilgili bir deyis var buraya yazardim ama ihrac edilebilirim. : limonu da siktilar ..... ler ile biten birsey, o yuzden baliga limon sikilir. hatta limon, sarmisak, zeytinyag tuz uclemesinden enfes bir sos yapilir. hatta balik yendikten sonra eller limon suyu ile yikanir. simdi kaybolun.uyarilar uzerine gelen edit ; limon, sarmisak, zeytinyag tuz ucleme degil dortleme gibi gorunuyor ama limon ana konuydu kaliyor uc :)",28.08.2015 12:13 ~ 29.08.2015 07:11
endemikdavar,1225362,neden birbirimizi öldürüyoruz ki zaten öleceğiz,4898135,54366379,"daha bikac saat once dusundugum sey, sahi neden ? hadi kabul edemesemde agaclari kesiyoruz, hayvanlari olduruyoruz ama konusabildigimiz iletisim kurabildigimiz canlilari nasil oldurebiliyor sunuz ? hayvanlarin bakislarindan anlamiyorsunuz belki ama, imdat diyen, help diyen bir canliyi nasil oldurebiliyor sunuz ?",28.08.2015 11:25
endemikdavar,1225362,hüloooğğğ'un ingilizcesi,4897487,54343794,turkcesi ne ki ?,27.08.2015 14:06
endemikdavar,1225362,uzun saçlı kızların el yazısının güzel olması,4897469,54343526,"sacim uzun ama az once telefonla konusurken aldigim notu telefonu kapattiktan sonra okuyamadim, bir zamanlar guzeldi kabul, klavye icat oldu mertlik bozuldu.",27.08.2015 13:57
endemikdavar,1225362,hayatında hiç a. kerzhakov okumamış insan,4896694,54337450,benim bu. basvurulari nereden yapiyoruz ?,27.08.2015 08:52
endemikdavar,1225362,wayward pines,3857703,54336894,"dun aksam 10. bolumunu izlemistim, acaba ikinci sezon ne zaman baslar derken siz bana final diyorsunuz. nasil final olur ? okula giden birinci jenarasyon ne oldu ? kurtuldular mi ? bulamadi mi onlari abbyler ? madem o kadar guzel korunakli bir yer , halkta gorecegini gordu zaten birdaha evden disari cikmazlardi niye adamlari oraya toplamadiniz ? pilcher'i oldurmek istemistim, adamin heykelini dikmisler bide.",27.08.2015 07:25
endemikdavar,1225362,çaylaklıktan çıkmanın dayanılmaz hafifliği,998152,54336865,"klasik olarak hergun acip kacinci siradayim acaba diye bakiyor, rakamlar eksilince az kaldi be kizim diyordum. ve tum bunlarin eski mailimin hacklenmesi,eski adimi, sifremi unutup ikinci kez bastan bastan yasandigini dusunun. bir yandan da su var bol keseden salliyordum ne guzel ve nasilsa kimse okumuyordu ve rahatliyordum ben, daha uc gunluk yazarim ama mesaj kutusu hep yesil. yalniz birakin beni be. "" i am very private person""",27.08.2015 07:15 ~ 07:16
endemikdavar,1225362,kız istemeye giderken dikkat edilecek hususlar,1204852,54317203,"benim kayin birader gibi bahceye sigara+cay icmeye cikip arabadan viski sisesi alip gelip kizin babasina da ikram etmeyin hic hos olmuyor. kiz babasi annesine "" dua etsinler kizin hatri var yoksa kovardim evden"" diyebiliyor. kayinbirader terimi dogrumu bilmiyorum ama ona bir cift sozum var ; lan pezevenk her allahin gunu iciyorsun zaten o gun icmeyiver. hadi ictin nisana niye sarhos gelmeye calisiyorsun.",26.08.2015 13:55
endemikdavar,1225362,kuşum aydın'ın askerlik fotoğrafı,4896356,54314953,aferin ona yalniz ben cozemedim hangisi kusum aydin ?,26.08.2015 12:19
