username,userId,entryTitle,entryTitleId,entryId,entry,entryDate
endemikdavar,1225362,balık al yanına da büyük rakı açarız diyen kadın,5196883,63189364,"rakının aslında balıkla değil, masadaki diğer deniz ürünü ve zeytinyağlı mezelerle içildiğini bilmeyen kadındır. rakı içilmelik bir durum varsa illaki balığa gerek yoktur :)",28.09.2016 16:07
endemikdavar,1225362,kitaplıkta olması utanç veren kitaplar,5143094,63144529,şizofren aşka mektuplar - cezmi ersöz üstelik altını çizdiğim bir sürü bölüm var :) resmen aşıktım ve cezmi ersöz hem bu kitapta hem de lemandaki sayfasında bizi anlatıyordu sanki. aklıma gelmişken tekrar kurcalayayım biraz gülerim salaklıklarıma :),26.09.2016 00:49
endemikdavar,1225362,başak burcu erkeği,272546,63029663,"bugün birtane daha geldi dünyaya bu erkekten. 19.09.2016 saat 07:30 itibariyle 2500gr olarak katıldı aramıza. adını poyraz ateş koydum, ileride genel kurmay başkanı yapacağım yeğenimi :) sağlıklı uzun ömrü olsun, amintobello :)",19.09.2016 17:37
endemikdavar,1225362,herkese bir kere nick değiştirme hakkı verilsin,1231310,62949984,(bkz: up),15.09.2016 08:05
endemikdavar,1225362,iphone 7 plus 256gb tr fiyatının 5800 tl olması,5185632,62828761,"türkiyeden bu fiyata alacak olanlar net gerizekalı ya da zengindir. zengin değilseniz, havalar soğuyunca aynı paraya 1 hafta thailand'a gidip, uçak, konaklama, eğlence dahil bu fiyata alabilirler.not: amerika, vize, pahalı uçak bileti gerektirdiği için örnek verilmemiştirz",08.09.2016 11:33 ~ 11:34
endemikdavar,1225362,burs veren sözlük yazarları,4786940,62781386,"burs'u tanıdığı bildiği gerçekten ihtiyacı olanlara vermek gerektiğine inanıyorum. üniversitedeyken bir arkadaşım vardı, beşiktaşta dublex evleri vardı, babası banka müdürü emeklisi. kız elazığlılar derneğinden burs alıyordu, kimbilir ihtiyacı olan kimlerin hakkından çalarak. imkanınız varsa sürekli, değilse arada bir de olsa kıyak yaparak vermeye çalışın. ben üniversitedeyken büyük evli bir arkadaş eşyalarını değiştirirken çamaşır makinası, fırın vermişti çok sevinmiştim.",05.09.2016 22:05
endemikdavar,1225362,artık şehitlere ağlamayan halk,5182829,62746142,"geçen yıl ortaokuldan arkadaşımın kardeşi mayınlı bir saldırıda şehit olmuştu, buraya da yazmıştım. üzerinden 1 yıl geçti mezarlığın yanından geçiyorum halen yapılmamış, şehitlik parası diye birşey varmış bu olay sonrasında duydum, 200k ya da 400k emin değilim. neyse olay şu ki şehidin babasına gidip soruyorlar okul yaptıralım ismini verelim şehidimizin, sen de biraz destek ol. o cenazede ağlayıp sızlayan adam, ben ev alıcam, arabamı değiştiricem, gezicem bundan sonra diye tek kuruş yardım etmemiş şehit oğlu adına. hep denir ya, ölseydim de bugünleri görmeseydim. ölenlerin buradan daha iyi biryere gittiklerinden emin olmasam bile en azından kurtulduklarını düşünüyorum. bu yüzden üzülmüyorum. daha dün kardeşinin cenazesinde haykıran yanlış hatırlamıyorsam yarbay fetöcü diye mesleğinden oldu, eminim ki ölen kardeşi yaşasaydı bu muameleyi o da görürdü ama öldü, kim için, ne için öldü ? vatan mı ? bırakın allah aşkına. iki kardeş biri vatan için ölüyor şehit, kahraman oluyor, diğeri alevi, isyankar kardeşinin cenazesinde ağladı diye vatan haini , fetöcü. olmaz olsun böyle vatan. ömrümün normal şartlarda yarısındayım, tuzum kuru değil, güvenli bölgede değilim. yarın havalimanında ölebilirim ya da bir düğünde. üzülmekten yoruldum.",03.09.2016 23:43
endemikdavar,1225362,norveç'te kadınlara zorunlu askerlik,3895772,62584990,bir kadın olarak norveç'in vatandaşlık şartlarını inceletecek haberdir. zira ordusu böyle adamlar barındırıyor ;https://onedio.com/…edikleri-norvecli-tegmen-709590adamın saçı bile sözlük yazarlarından yakışıklı :),26.08.2016 19:42 ~ 19:43
endemikdavar,1225362,ineklerine yıldırım çarpan çifte yardım kampanyası,5177664,62571871,"az önce haberi gördüm, umarım birileri açmıştır ümidiyle sözlüğe girdim. başlatılırsa kesinlikle destek olacağım kampanya. gece gece ciğerim yandı.",26.08.2016 03:12
endemikdavar,1225362,vajinasının üstünde tuğla kırdıran kadın,5175684,62513681,"vajinasından 1,5 metre jiletli ip çıkaran, ok atıp 2 metre mesafedeki balonları patlatan, cam şişe kola açan, yazı yazan, pinpon topları çıkaran, sigara içen kadınlar(?) gördüğüm için bana garip gelmedi. sadece orada show'u(?) nasıl yarım bırakıp çıktıysam, aynı his bunu izlerken de oluştu.",23.08.2016 14:19
endemikdavar,1225362,ekşicilerin geçim kaynağı,6149133,62456926,işsizlik maaşıyla. aralık ayına kadar böyle :),20.08.2016 19:12
endemikdavar,1225362,fringe'den akılda kalanlar,4568672,62436879,"peter'in gerçek hayatta gay olması. tam anlamıyla hayal kırıklığına uğramıştım. ( homofobik değilim, aşıktım) ve bir de (bkz: massive dynamic)holywars'a bilgilendirme için teşekkürler, adam gay değilmiş. bu benim ne işime yarayacak bilmiyorum ama ne bileyim tekrar mı izlesem ?",19.08.2016 17:47 ~ 19:42
endemikdavar,1225362,nerelisin sorusuna ilçe ismiyle cevap veren insan,3800888,62403985,"fethiye. çünkü il olmayı hak etmesinin yanı sıra muğladan güzeldir, muğlaya uzaktır :)",18.08.2016 02:37
endemikdavar,1225362,köydeki evi yaptırmak,5171763,62402488,"büyükşehir kanunundan sonra köy diye birşey kalmayıp hepsi mahalle olduğu için yaptırıcam diye hayallere kapılmayın benden söylemesi. şimdiden gidin muhtarı vesaireyi bulun sorun, imar durumunu öğrenin. tapuya işlenmiş eski bir bina var ise ona göre tadilat ruhsatı alabilirsiniz lakin yoksa babalara geldiniz demektir.hem köyde hem şehirde ev yaptırıyor olan biri olarak söylüyorum, ikisinde de aynı kurallar var. belediye tip proje altında ev planları veriyor cüzzi bir miktara (beton) beğenmiyorsan mimara vereceksin, minimum 7.000 tl. bunun haritacısı, belediye harçları falan filan daha başlamadan 10-15.000 gidiyor. diyelim ki 3 dönüm tarlanız var ve şu köşeye ev koyayım diyorsunuz, yanından yol geçmiyorsa koyamazsınız. geçiyorsa da koyamazsınız çünkü 4 tarafından da 3 metre kuralı var, yani her bir yandan 3 metre içerde başlamak zorundasınız. 3 dönüm araziye 250 m2 inşaat izni verdiler diyelim 125-125 tek katlı iki tane yapabilirsiniz ya da iki katlı 125-125 birtane bina yapabilirsiniz. en iyisi ahşap bungalow diyoruz ya, onu da unutabiliriz zira oturma ruhsatı vermez belediye, illaki betonerme istiyor. yani betopen kullanılan bungalow evler olur ancak. ve bu evler de yukarıda yazdığım kurallara dahil. kısacası devlet doğaya uyum filan tanımıyor, köyleri bile betonlaştırdılar.",18.08.2016 00:45
endemikdavar,1225362,sözlükçülerin hastalıkları,3906696,62402302,(bkz: vertigo)allah düşmanıma vermesin dedirtir.,18.08.2016 00:35
endemikdavar,1225362,swanswan,4585580,62396160,"bende mutfak balkonunu camla kapatıp mutfağa dahil eden, türk kahvesini de alıp cam kenarında sigara içen hafif dip boyası gelmiş sarı saçlı 45 yaşında iki çocuk annesi bir ev hanımı izlenimi yaratmış yazardır. bizim buralarda bir söz var "" boy devede de var ama önünden eşek çekiyor"" . ha unutmadan, prenses ve prens annesi nedir yahu, şişirin egoları bakalım.",17.08.2016 18:43
endemikdavar,1225362,yeşil zeytinin aslında yeşil olmaması,5172111,62390335,bütün hepsi yeşil dese anlıycam ama sarı ne aq. yazık kimin çocuğuysa :(,17.08.2016 13:48
endemikdavar,1225362,insanlığın sıkılıp yemeyi bırakacağı ilk yiyecek,5170674,62357819,"hurma olmasını temenni ediyorum, bak şimdiden paketten 10 tane yedim :(",15.08.2016 22:20
endemikdavar,1225362,ekşi itiraf,1037199,62316833,"geçen hafta daha önce deli gibi sevdiğim adam geldi yaşadığım şehre. üstelik o gün doğum günüydü. 3 yıldır görmedik birbirimizi, gittik yemek yedik, dolaştık etrafta. beraberken birbirimize söylemediğimiz ne varsa söyledik. bana neden teklifimi kabul etmedin, etseydin şuanda evli olmazdım sen de evleniyor olmazdın, nasıl evlenirsin inanamıyorum sana dedi. ben seni çok sevdim, bambaşka birşey vardı bizim aramızda, asla pişman olmayacağım ve belki birdaha asla yaşayamayacağım hisler dedi. korktum dedim, sadece korktum. çünkü sana duyduğum aşk benden üstün birşeydi ve benden üstün birşeyi kontrol edememekten korktum. şimdi sorsan neden evleniyorum ? bilmiyorum. sana olduğum kadar aşık mıyım ? hayır ama seviyorum ve çokça da seviliyorum. iyi biri. beni üzmez ama üzerse de beni biliyorsun çeker giderim dedim. umarım mutlu olursun, umarım üzülmez zararlı çıkmazsın bu işten dedi. bikaç gün önce mesaj göndermiş "" seni köpekler gibi özledim"" diye.eskiden olsa koşardım ben bu adama, koştum da. nerede olursa olsun 15 dakika vakit olsa bile koştum, gördüm. şimdi öylece izliyorum eriyişini. hislerim eskisi gibi mi ? hayır. sadece geçmişte eşsiz duygular yaşadığım bir adam var orada, o kadar. 2 ay sonra evleniyorum. umarım normal stadardlarda mutlu olurum, pişman olmam bu kaçışımdan.",13.08.2016 21:33
endemikdavar,1225362,domatese bibere zeytinyağı döküp kahvaltı eden tip,4479897,62316431,yufka bulunca taze maydonozu içine sarıp zeytinyağına da banıyordur.,13.08.2016 21:18
endemikdavar,1225362,enes kanter için yeni soyadı önerileri,5166879,62230060,"adamın yıllık geliri bizim ömür boyu kazanacağımız paradan fazla, kalkmış burda soyadı seçiyoruz. fakiriz ama komiğiz. yalnız sene 2016, bir insana bu türlü tapan bir nba oyuncusunun yeryüzünde var olması çok enteresan. uzun boylularda sinirlerde geç iletim oluyor derlerdi de bu kadarını beklemezdim.",09.08.2016 14:14
endemikdavar,1225362,ayna şakasını türkiye'de yapmak,5163911,62131526,"dikkatimi çeken bir nokta oldu bu videoda. normal şartlarda bu tarz videolarda kezban kızlarımız ön plandadır, şaka kaldırmazlar konuşmazlar. bu videoda da varlar gerçi ama dünyanın en tatlı çifti geçiyor bakın dediklerinde "" yaa evet evet geçiyolardı ben de gördüm bıdı bıdı"" diyen eleman var ya, acayip gıcık oldum ona. ve bu cinsten o kadar çok var ki, sevgilim olsa terk ederim. sonuç olarak çekmeyin şöyle videolar, insanımızdan yeterince soğuduk.",04.08.2016 13:17 ~ 13:17
endemikdavar,1225362,hayatta yenmiş ve yenebilecek en lezzetli yiyecek,4620094,62070342,lotus salatası.vietnamlılar bu işi biliyor.,01.08.2016 09:49
endemikdavar,1225362,seda sayan'ın oscarlık klip performansı,5157672,61972621,"üstüne açıp murat kekilliden dinlemeden atamadım kulağımdan bu sesi. gelmiş 60 yaşına hala bi 14 lük tripler. hayır bunun oğlu da modern bir tipe benziyor, hiç uyarmıyor mu ""anne sen napıyosun?"" diye.",27.07.2016 00:50
endemikdavar,1225362,limoncello,273391,61969654,"üniversitede ev arkadaşımın italyada yaşayan ablası göndermişti ve bayılmıştık. dışarıdan gelip antalyanın sıcağında dolabı açıp birer shot yuvarlamak pek keyifliydi. sonra bir başkasına getirttim italyadan lakin markası aynı değildi ve bildiğin zeytinyağ'ı gibiydi. o güzel olanın da adını unuttum, alkolü alıp evde denemeyi düşünüyorum belki aynı tadı yakalarım.",26.07.2016 22:11
endemikdavar,1225362,ailesinde fetöcü sayısı 0 olan insan,5157059,61929233,"aile kapsamına annesinin teyzesinin torunu girmiyorsa dahil olduğum gruptur. ben özel sektördeyim diye küçük görüyorlardı, oğulları öğretmen olmuş, hemen atanmış filan. şimdi gelsin babasının seralarında çalışıp görsün hanyayı konyayı.",24.07.2016 22:47
endemikdavar,1225362,oje süren erkekler,324851,61892793,"eşcinsel erkeklere yakışıyor (bkz: kerimcan durmaz) lakin sevgilimde düşündüm de, o tombul eller, ben düzeltmesem yamuk kestiği tırnaklar.... fena.",22.07.2016 22:57
endemikdavar,1225362,yazarların hissettiği en şiddetli fiziksel acı,4592812,61892469,"yurtdışında idrar yolları enfeksiyonu şüphesiyle gittiğim hastanede doktorun beni özel odaya alıp, hamile sandalyelerine oturtması, ben normal kontrol yapacak derken sonda iğnesiyle idrar almasıdır. hayatımda öyle bir acı hissetmedim, doktoru öldürmediysem yaşına hürmetimdendir.",22.07.2016 22:40
endemikdavar,1225362,tayland prensinin almanya ziyaretindeki giyimi,5155407,61880297,"bild o şekilde bir başlık atmış ama her ne kadar beğenmesekte dünyanın en zengin krallıklarından birinin prensi adam. yani bu haberi yapanla birlikte satın alır bild'i de almanyayı da. ılık filan diyenler olmuş ama adam aşkı uğruna royal olmayan bir artisti aileye sokmuştur. hoş ilişkileri çocuk yapmak üzerine kurulmuş gibi ama, bu da onun tercihi, adam prens. tabiki karşılamaya böyle gidilmez ama thailand hakkında birazcık birşeyler bilen, bir kez olsun orada bulunmuş olanlar kılık kıyafet konusunda ne kadar geri, anlamsız, vurdum duymaz olduklarını bilirler. sabah masalarına oturunca ayakkabıları çıkarıp pufidik terliklerini giyen insanlardan çok birşey beklememek lazım, sülaleleri rahat.",22.07.2016 10:17
endemikdavar,1225362,üniversitede en çok sevilen ders,5127927,61875705,anadolu uygarlıkları - prof. dr. nevzat çevik,22.07.2016 00:24
endemikdavar,1225362,arda turan,963149,61814632,"hakan şükür olayından hiç ders almamış insan beyanatı. oğlum başkomutanın dediğin insan hakan şükür'ü millet vekili yaptı zamanında, şimdi bulsa bir kaşık suda boğacak. hala fethiyedeysen bul beni allahın ergeni. zahmet etme ben aldırayım seni 5* lı otelinden.",19.07.2016 01:33
endemikdavar,1225362,trt'de darbe bildirisi okunurken düşünülenler,5152436,61803367,"biz dükkanda darbe bildirgemsi şeyi dinlerken, mekanın yanındaki bankamatikte herkes kuyruğa girmişti. nişanlı kişisi,bence sen de para çek ne olur ne olmaz dedi. ben, ne çekicem be bi bok olmaz dedim.ısrar etti, sanki her yıl darbe yaşamış gibi, anlattı işleyişi.ben, ulen çeksem ne kadar çekicem para kalmamıştır zaten orada, günlük limiti verse ne zamana kadar yetecek dedim. ama asıl içimden geçen şuydu, uzun başımızdan gidecekse, ben çalışır tekrar kazanırım o parayı, giderse gitsin.",18.07.2016 15:30 ~ 18:31
endemikdavar,1225362,darbe gecesi evinde oturanlar ülkeden kovulsun,5151226,61776656,"darbe(?) gecesi çin restoranında kızarmış dondurma yiyordum. yurtdışında kaldığım sürede hükümetimiz adına utandım ama türklük duygularım hep kabarık olduğu için türklüğümle onur duydum lakin artık türk'üm demekten de utanıyorum. bugüne kadar bunlar müslümansa ben müslüman değilim demiştim ve şimdi de bunlar türkse ben türk değilim diyorum. evet, gönderin beni.",17.07.2016 11:18
endemikdavar,1225362,16 temmuz 2016 ankara patlaması,5149835,61747546,fox haber'e göre tbmm vurulmuş.,16.07.2016 02:35
endemikdavar,1225362,bütün çomarları öldürecek buton olsa basar mısın,5147930,61712188,"basarım. bu beni katil yapmaz. çünkü ben sevgi doluyum ama insanların hepsini ayırt etmeksizin sevmiyorum, hümanist değilim demek ki. ailemi, dostlarımı sevdiğim gibi çocuk katillerini tecavüzcüleri, dünyanın bu hale gelmesinde en ufak katkısı olanları sevmemi nasıl beklersiniz ? insan zaten dünya üzerindeki en zararlı canlı, ben çomarsam, gelecek nesillerin hayallerini ellerinden alıyorsam, dünyayı bir bok çukuruna çevirmeye çalışıyorsam, benim için de basın.",14.07.2016 09:43
endemikdavar,1225362,paraşütçüleri röntgencilikle suçlayan türbanlılar,5148153,61704067,"mevzuyu dün bir arkadaşımdan duyup yok artık o kadar da değildir demiştim çünkü bahsi geçen otel eski ölüdeniz resort hotel, faralya'ya giden varyantın dibi. şu saatte gitsen kenarda 50 araba vardır. birileri demiş türbanlı kadınlar hakkında bik bik konuşuyorsunuz vay efendim bu açık giyinen kadınlara orospu diyen zihniyetle aynı olur. hayır efendim olmaz. neden ? çünkü ben de paraşütle atladım, zaten inişe geçmişken bir saniye gibi bir sürede "" oha lan ne karılar var be"" diyecek bir vakit yok, kaldı ki inişe odaklanıyorsun. bundan rahatsız olan zihniyet, yeryüzünde yaşamaması gereken bir zihniyet.",13.07.2016 20:13
endemikdavar,1225362,pokemon go,4909151,61661358,"adamı pc başından kaldıramıyorum diye şikayet ediyordum, demin gördüm motorla pokemon avında. işin yoksa sokaklarda adam ara bundan sonra, en azından eskiden yerini biliyordum.az önce bankaya gittik, veznede iki tane bulmuş, ona seviniyor , 1700 liralık kredi taksidini de topladığı pokemonlar ödeyecek sanırım.",11.07.2016 15:31 ~ 12.07.2016 15:58
endemikdavar,1225362,8 temmuz 2016 anıtur benelüks paris turu rezaleti,5145932,61628292,"oysa alpin gayet mutluymuş.... ---- burada alpin'in facebook profili vardı, mevzubahis grupla gayet mutluydu ---duayen dediğim birkaç rehber arkadaşım var facebookta, eğer ismi verilen rehber onları tanımıyorsa, işe yaramaz rehber kategorisine alıyorum. alpin'i de aldım ama onun bundan haberi yok.link'i kaldırdım aman banane, suçu ispatlanana kadar herkes masumdur. ne diye gaza geldiysem :)",09.07.2016 19:21 ~ 19:41
endemikdavar,1225362,ege sahilinde istanbul trafiği,5144758,61582008,"bayramda oraya gelmeyi düşünüyoruz diyenlere, sakın öyle bir hata yapmayın demiştim. ve yine haklı çıktım. https://www.facebook.com/…579459&id=240660572795656la hani su veren itfaiye hortum filan ne oldu ? zaten belediye park yerlerini ücretsiz yaptığı için esnaf işe arabasıyla geliyordu ve park yeri yoktu. şimdi tam tüy diktiler. aman neyse zaten ben köye kaçtım, yabancı plakalar gidince inicem merkeze.",06.07.2016 21:21
endemikdavar,1225362,cicişlerin kutsal topraklar'a gitmesi,5141081,61469456,ojelerini silmeden gitmişlerdir.,30.06.2016 18:42
endemikdavar,1225362,mavi marmara giderken içindekiler bize mi sordu,5140639,61456092,(bkz: mad king) (bkz: burn them all),30.06.2016 00:32
endemikdavar,1225362,minik eymen celep'e yardım ediyoruz kampanyası,5113129,61441648,"ablam, eniştem ve kendisi için fitre yatırmaları gerektiğini onlar için türk hava kurumu gibi kurumlara ( bizim oralarda onlar bilinir hep) yardım gönderebilir misin diye sordu. diğer güvenilir kurumlara ( lösev gibi) göndermeyi düşündüm ama sol frame de görünce ben de bu vesileyle yardımda bulunmak istedim. lütfen çevrenizdekileri de uyarın, bir üstteki yazarın dediği gibi fitre/ zekat ödemeleri dönemi. toplanan para çok az, belki katkısı olur.",29.06.2016 12:08 ~ 12:29
endemikdavar,1225362,game of thrones,2213329,61409821,(bkz: lyanna mormont)konuşurken gözleri dolan birtek ben değilimdir sanırım.,28.06.2016 00:28
endemikdavar,1225362,köy öğretmeninin öğrencisi ile yaptığı düet,5138258,61388680,"öğretmen sert diyenlerin kesin sesi güzel değil. nedenine gelince, eğer amatör olarak şarkı söylüyorsanız, çalan insanı pür dikkat izlersiniz ve çalan kişi size bakışlarıyla söyler nerede şarkıya gireceğinizi, daha değil ve şimdi gir bakışı onlar. didem de ne güzel utanıyordu lakin utanmanın yanında çocukluktan ötürü diyaframı ayarlayamama heyecanı vardı. beni ilkokul yıllarıma götürdü, benim öğretmenim de bağlama çalardı, teknoloji keşke o zamanlar da da ileri olsaydı da kaydedebilseydik o anıları.",26.06.2016 23:58
endemikdavar,1225362,bankada kuzu hastanede kurt,5138300,61388468,"bankalar hesabına para yatırırken/ çekerken idrar tahlili isteseydi karşılaştırma uygun olabilirdi. bu durumda şartlar eşit değil. bazı doktorların birtakım eşyaları çalındı diye iki merdiveni zor çıkan bir dedeyi kimse bağırıp çağırarak suçlayıp, hakaret edemez. "" lütfen biz sizi çağırana dek dışarıda bekleyiniz "" denir ancak. bu olaya ben tanık olsaydım, kameraya çekmez olaya müdahil olurdum. bu insanlar bizim devrimizde doğmadı, babamız değil, dedemiz yaşındalar. günümüz kurallarını bilmeyebilirler.şöyle bir anımı anlatayım;geçen yıl bir avm'nin dışarıda olan bir restoranında oturuyorum, muhtemelen hastaneye gelmiş( şehre ancak bu şekilde iner bizim oradakiler) iki tonton, köylü yaşlı çift geldi oturdu. garsonlar ilgilenmiyor çünkü onların buranın hesabını kaldıramayacağını biliyorlar. izledim onları 15 dakika kimse gelmedi masalarına, sanırım onlarda soluklanmak istedi. kalktım gittim yanlarına "" teyzecim ne alırsınız? dedim. ne var ki kızım burada dedi. açmısınız diye sordum. kızım benimki bişi yemedi hastaneden çıktık şöyle meyve suyu gibi bişiler olsaydı iyiydi dedi. tamam dedim ben hallediyorum. iki peynirli birşeyler, meyve suyu, su söyledim masalarına, hesaplarını da ödedim ( çünkü aynı anneannem ve dedem gibiydiler) sonra bana o yaşlı insanlar ne sordu derseniz, "" kızım bunun birini yiyemedik peçeteye sarsam mı ? suyu da içtik ama boşunu alalım mı ? kullanırız şişeleri dedi. şimdi kıssadan hisse, o yaşta zaten parasını ödedikleri pet şişeyi alabilir miyiz diye soran, yolu yordamı bilmemeleri gayet normal olan insanların kapı açık diye doktor odasına girip oturmaları kadar normal ne olabilir ? yoksa tıp okuyanların bütün yaşlı çevresi zamanında avrupada mı tahsisini tamamladı ? hepsi mi eğitimli ?",26.06.2016 23:49
endemikdavar,1225362,dövme yaptırılası sözler,2275931,61354915,"ne yazdırırsanız yazdırın kiloluyken yazdırmayın :) ya da kilo alınca formu bozulmayacak biryere yazdırın. bir de orantıyı iyi ayarlayın gaza gelip olur farketmez demeyin benim gibi. ucuna başka birşey eklemek istiyorum sığmıyor şuanda. "" est sularus oth mithas"" onurum, hayatımdır. yaptıralı yıllar oldu, orada olduğunu bile unutuyorum birisi sorana dek. ne yazıyor ? sorulara da klasik cevabım "" huzur namazda"".ha bir de , ömür boyu felsefe edinmeyeceğiniz hiçbirşeyi vücudunuza yazdırmayın.",25.06.2016 00:24
endemikdavar,1225362,bir kadının tek başına tatile çıkması,3901061,61341397,"gidin kızlar, hiç çekinmeyin. en güzeli 2014 te tek başına çıktığım ispanya- fransa turuydu. ispanyadan fransaya geçmek zaten 25 euro falandı. gitmişken birkaç ülke görün. kaybolun, keşfedin. tek sorun fotoğrafları kim çekecek olayı, zaten o kadar çok yalnız ya da çift gezen var ki, mutlaka fotoğrafımızı çeker misiniz diye soran birileri olacak, benimkini de çekerseniz neden olmasın diyin. ben yaptım, herkes birileriyle gittiğimi sandı bu yüzden. ispanya'da birtane hardrock çalışanı "" demek yalnız geldin, akşam parti var istersen gel "" ve fransada kurukta tek kelime ingilizce bilmeyen ama telefonda saat gösterip "" drink"" diyen fransız çocuk hariç asılma olayı da yok. ha birtanesi asıldı fransada, otelin sokağına kadar beni bırakırken, tamam otelim şurada dediğimde "" ben de geleyim mi ?"" diye soran çocuğu zaten yanlış anlayıp "" yok, ben kendim giderim, iyi akşamlar"" demiştim. jeton sonradan düştü, ve o çocuk türktü. ( nereye gitsem, buluyorum böyle şeyler) tekrar söylüyorum, gidin, gezin, görün. zira nişan, evlilik yoluna girince sadece kardeş ve kız arkadaşlarınla gitmeye izin var.",24.06.2016 10:27
endemikdavar,1225362,insana mutluluk veren kokular,4440116,61312249,yasemin ve akşam sefası kokusu ...summer of 2002. vaaay be.,22.06.2016 22:50
endemikdavar,1225362,yağmur ve kapalı hava seven insan,3905205,61271495,"gayet normal insandır. soğuğa çözüm var ama sıcak öyle mi ? ben ki 5 yılımı 12 ay yaz olan bir ülkede geçirdim, böyle bir sıcak görmedim. sanırım koltukta eriyip buharlaşıcaz hepimiz.",20.06.2016 23:53
endemikdavar,1225362,öğretmenlerin okul sütünden yoğurt yapması,5133765,61249411,"biri de dememiş ki okulda tencerenin ne işi var :) neyse, çöpe atılmasından iyidir.",19.06.2016 23:50
endemikdavar,1225362,çocukken ansiklopedi okumak,59227,61187846,"15 yıl evden ve ülkeden uzak geçirip geçenlerde uzun zamandır dokunulmayan kitap dolabını boşalttım, temizledim. ansiklopedilerimin tozunu aldım, dinazorları ilk keşfettiğim yerleri tekrar tekrar okuyup ilk kez okuduğumdaki anlara döndüm.evde benden başka onlarla ilgilenen olmadığı için toz tutmuşlardı, silip tekrar sıralarken acaba çocuklarım da benle aynı heyecanı hisseder mi bunlara bakarken diye hayaller kurdum. az dönem ödevi yapmadık onlarla, vay annesini :(",17.06.2016 00:03
endemikdavar,1225362,ilkokuldan akılda kalanlar,467916,61145900,"ilkokul 2 , rahmetli hürriyet hocamız bütün sınıfı tahtanın önüne dizdi, ""esneyin "" dedi. hepimiz birbirimize bakıyoruz, vakit öğleden sonra, neden esneyelim, nasıl esneyelim diye. çok sonraları anladık, hoca folklör grubu kuracakmış ve ayaklarımızın ucunda esnememizi istiyormuş meğerse. yaş 8, bildiğimiz tek esneme uykudan uyanınca olan :)",14.06.2016 22:51
